<?xml version="1.0" encoding="utf-8"?>
<carteDuJeu xmlns="http://www.univ-grenoble-alpes.fr/l3miage/ourGame"
         xmlns:xsi="http://www.w3.org/2001/XMLSchema-instance"
         xsi:schemaLocation="http://www.univ-grenoble-alpes.fr/l3miage/ourGame  ../xsd/CarteDeJeu.xsd">
    <carte>
        <vie></vie>
        <degat></degat>
        <nom></nom>
        <image></image>
        <cout></cout>
        <type></type>
        <invocation>
            <vie></vie>
            <degat></degat>
            <pseudoInvocateur></pseudoInvocateur>
            <estJouable></estJouable>
        </invocation>
        <rarete></rarete>
    </carte>
    
    
</carteDuJeu>    
    